Conflict,Combatant 1,Combatant 2,Result
League of Prizren Secessionist War  (1880-1881),League of Prizren,Ottoman Empire   Principality of Montenegro  The Great Powers,"Defeat League of Prizren captures areas of Kosovo and prevents Montenegrin annexation of Ulcinj. Great Powers blockade Ulcinj and request the Ottomans ""to pacify"" the League. Ottoman forces take Prizren, dismantle the League and deport the leaders of the League from Kosovo. They then invade Ulcinj and deliver it to Montenegro."
Albanian Revolt of 1909  (1909),Malsor Tribesman,Ottoman Empire,Defeat Rebellion crushed. Albanian clans retreat to Montenegro.
Albanian Revolt of 1910(May-June 1910),Kosovar Rebels   Shkodran Rebels   Dibran Rebels   Malsor Tribesman  Support:   Kingdom of Serbia,Ottoman Empire,"Defeat Areas of the Kosovo Vilayet captured by the Rebels are partially retaken by the Ottomans. Ottomans invade Shkodër and Dibran territories, including Debre. Rebellion suppressed. Rebels limited to the highlands."
Albanian Revolt of 1911(1911),Malsor Tribesman   Shkodran Tribesmen,Ottoman Empire,Peace is negotiated Albanian victory in the Battle of Deçiq. Compromise reached afterwards ending the revolt.
Albanian Revolt of 1912(1912),Kosovar Rebels   Gheg Rebels   Shkodran Rebels   Malsor Rebels   Dibran Rebels   Central Albanian Muslims   Tosk Rebels   Mati Tribesmen Mirdita Tribesmen   Ottoman Albanian Deserters  Armaments Support:   Kingdom of Montenegro  Vocal Support:   Austria-Hungary   British Empire   Kingdom of Bulgaria,Ottoman Empire,"Victory Albanian Rebels capture Üsküp and all of the Kosovo Vilayet, large parts of the Scutari Vilayet and Dibër (Debar) in the Monastir Vilayet. Ottomans agree to Albanian demands, including the formation of the Albanian Vilayet. However the outbreak of the First Balkan War prevents this vilayet from de facto forming."
Serbian invasion of Albania during the First Balkan War  (1912-1913),Ottoman Empire  Albanian guerrillas  Albanian Tribesmen,Kingdom of Serbia,"Serbian Victory Serbia defeats Ottoman forces and captures large areas of Kosovo, Macedonia, Northern Albania and Central Albania. The Serbian army commits massacres against the Albanians living there. Serbia forms Drač County and other counties on Albanian-populated lands captured from the Ottomans. Serbia is forced to retreat from parts of Albania following the signing of the Treaty of London. Serbia annexes Kosovo and Macedonia and continues to occupy northern Albania. Austro-Hungarian pressure forces Serbian retreat from Northern Albania by November 1913."
Battle of Lumë  (1912),Albanians from Luma   Albanians from Dibra   Albanians from Gjakova highlands,Kingdom of Serbia,Victory Capture of the Tower of Luma. Serbian withdrawal from the region of Lumë.
Siege of Shkodër  (1912-1913),Ottoman Empire   Albanian volunteers  Naval Support in May 1913 only:   British Empire   Kingdom of Italy,Kingdom of Montenegro  Kingdom of Serbia,Status quo ante bellum Essad Pasha hands Shkodër over to Montenegro in return for Montenegrin support for the foundation of the Republic of Central Albania. Shkodër is assigned to the Principality of Albania in the Treaty of London. Montenegrin forces retreat from Shkodër in May 1913.
Greek invasion of Albania and Epirus during the First Balkan War (1912-1913),Ottoman Empire  Albanian guerrillas  Albanian Tribesmen,Kingdom of Greece,"Greek victory Ottoman troops are defeated in Epirus and Albania. Çamëria/Southern Epirus is annexed by Greece. Northern Epirus is occupied by Greece. Greeks retreat from Northern Epirus after the region is annexed by Albania following the Protocol of Florence. Northern Epirus declares independence shortly after the Greek retreat, resulting in the First Northern Epirote Uprising."
Uprising of Dukagjini  (1919),Kosovar Albanian Kachaks   Committee for the National Defence of Kosovo,"Kingdom of Serbs, Croats and Slovenes",Mixed results Yugoslav forces quell rebellion in the Drenica/Dukagjini area.
Vlora War(1920),Principality of Albania Albanian Rebels,Kingdom of Italy  Italian protectorate over Albania,"Victory Rebellion across Albania limits Italian control to the city of Vlora. Rebels storm Vlora, forcing Italian retreat to Sazan and Italy. All Italian-controlled territory in Albania is regained, excluding Sazan."
Albanian Revolt of 1922  (1922),Principality of Albania,Albanian Kachaks   Committee for the National Defence of Kosovo,Albanian Principality Victory Kachaks capture parts of north-eastern Tirana. British diplomat Harry Eyres convinces the Kachaks to retreat to Dibër and Kosovo.
Kachak Invasion of Albania  (1923),Principality of Albania,Kosovar Albanian Kachaks   Committee for the National Defence of Kosovo,Albanian Principality Victory Kachak offensive into northern Albania captures areas in the Has and Tropojë districts. Albanian offensives pushes the Kachaks back into Kosovo and captures Junik. The Neutral Zone of Junik in Kosovo is ceded by Albania to Yugoslavia. Resistance against Yugoslav annexation causes the Drenica-Junik Uprising.
June Revolution  (1924),Fan Noli supporters (Albanian peasants)   Committee for the National Defence of Kosovo,Ahmet Zogu supporters (Mati Tribesmen),Noli Victory Fan Noli becomes the head of the state and prime minister of Albania Ahmet Zogu flees to Yugoslavia
Drenica-Junik Uprising  (1924),Kosovar Albanian Kachaks   Committee for the National Defence of Kosovo,"Kingdom of Serbs, Croats and Slovenes",Kachak Defeat Yugoslav forces annex areas of the Neutral Zone of Junik and Drenica. Azem Galica is killed.
Yugoslav Invasion of Albania  (1924),"Ahmet Zogu supporters (Mati Tribesmen)  Kingdom of Serbs, Croats and Slovenes  Royal Yugoslav Army  Russian White émigré",Fan Noli supporters (Albanian peasants)   Principality of Albania   Committee for the National Defence of Kosovo,Yugoslav-Zogu Victory Fan Noli is ousted from power. Ahmet Zogu forms the Albanian Republic and is made dictator. Zogu's forces assassinate the leadership of the Committee for the National Defence of Kosovo.
Italian invasion of Albania(1939),Kingdom of Albania,Kingdom of Italy,Defeat Italian occupation of Albania
Greco-Italian War  (1940-1941),Kingdom of Italy  Italian Albania,Kingdom of Greece  Air support:   British Empire,"Stalemate Greek tactical victory, strategic stalemate. German intervention in 1941 with eventual Greek surrender."
Albanian Resistance of World War II(1939-1944),LANÇ  Legality Movement Balli Kombëtar (Until 1943),Kingdom of Italy (Until 1943)  Italian Albania  Nazi Germany (From 1943)   German Albania  Balli Kombëtar (From 1943)  Second League of Prizren (From 1943),Albanian Communist Victory Liberation of Albania from Axis occupation. Balli Kombëtar defeated. Albania becomes a Communist state.
Cold War (1945-1991),,,,,
Corfu Channel incident(1946-1948),Albania,United Kingdom,World Court case in 1949 Albania pays compensations to Britain
Greek Civil War(1946-1949),Provisional Democratic Government  DSE  NOF partisans Supported by:  Socialist Yugoslavia Socialist Albania,Kingdom of Greece  Hellenic Army Supported by: United Kingdom United States (after 1947),Mixed results Communist forces defeated.
Pyramid Crisis(1997),Berisha Government Italy Turkey Greece,Rebels,Government victory Restoration of law and order in Albania. New Parliamentary elections held.
Kosovo War - Albania-Yugoslav border incident(1999),Albania   KLA  Supported by:  NATO,FR Yugoslavia,KLA/Albanian Victory Yugoslav forces retreat to Yugoslavia Albanian army retakes control Albania breaks diplomatic relations with Yugoslavia[23] Kumanovo Treaty Kosovo declares independence in 2008
