Conflict,Combatant 1,Combatant 2,Results
Filibuster War(1856-1857),Costa Rica Nicaragua Guatemala Honduras El Salvador United States,Filibusters,Victory William Walker's army is defeated and he is arrested by the American Navy
World War I(1918),France United Kingdom Russia United States China Italy Japan Canada Australia New Zealand India South Africa Serbia Romania Belgium Greece Portugal Brazil Honduras,Germany Austria-Hungary Ottoman Empire Bulgaria,"Victory End of the German, Russian, Ottoman, and Austro-Hungarian empires Formation of new countries in Europe and the Middle East Transfer of German colonies and regions of the former Ottoman Empire to other powers Establishment of the League of Nations"
World War II(1941-1945),Soviet Union United States United Kingdom China France Poland Canada Australia New Zealand India South Africa Yugoslavia Greece Denmark Norway Netherlands Belgium Luxembourg Czechoslovakia Brazil Mexico Ethiopia Honduras,Germany Japan Italy Hungary Romania Bulgaria Finland Thailand Manchukuo Croatia Slovakia,Victory Collapse of the Third Reich Fall of Japanese and Italian Empires Creation of the United Nations Emergence of the United States and the Soviet Union as superpowers Beginning of the Cold War
Nicaraguan revolution(1961-1990),"Somoza government  National Guard  Contras (1981-90)Supported by: United States Israel Saudi Arabia[1][2][3] Honduras Chile (since 1973)[4] Brazil Paraguay Argentina (1961-83) Panama[5] West Germany Pakistan Philippines Imperial State of Iran (until 1979) Islamic Republic of Iran (Indirectly, since 1979)[6]",FSLN  EPS Supported by: Libya[7] Soviet Union China Cuba[8]  Bulgaria[9] Romania (until 1989)  Czechoslovakia (until 1989)  Poland (until 1989)[7][10] Mexico[11]  Iraq  East Germany (until 1989)  Chile (1970-1973),Defeat •FSLN military victory in 1979  Overthrow of Somoza government Insurgency of the Contras Electoral victory of the National Opposition Union in 1990 FSLN retained most of their executive apparatus
American occupation of the Dominican Republic(1965-1966),United States Brazil Honduras Paraguay Nicaragua Costa Rica El Salvador Dominican Armed Forces Training Center (SIM) Dominican Military Intelligence Service,Dominican Republic,Victory Juan Bosch excluded from Presidency Election of Joaquín Balaguer
Football War(1969),Honduras,El Salvador,Ceasefire Status quo ante bellum Ceasefire by OAS intervention
Operation Golden Pheasant(1988),Honduras United States,Nicaragua,Victory Withdrawal of Nicaraguan forces from Honduran territory
Iraq War(2003-2011),United States United Kingdom South Korea Italy Poland Australia Georgia Ukraine Netherlands Spain Denmark Honduras Iraq  MNF-I   United States   United Kingdom   Australia   Romania   El Salvador   Estonia   Bulgaria   Moldova   Albania   Ukraine   Denmark   Czech Republic   South Korea   Azerbaijan   Singapore   Bosnia and Herzegovina   Macedonia   Latvia   Poland   Kazakhstan   Mongolia   Georgia   Tonga   Armenia   Slovakia   Lithuania   Italy   Norway   Japan   Hungary   Netherlands   Portugal   New Zealand   Thailand   Philippines   Honduras   Dominican Republic   Spain   Nicaragua   Iceland,Baath Loyalists ISI al-Qaeda in Iraq Mahdi Army Special Groups IAI Ansar al-Sunnah   Ba'athist Iraq,"Victory Invasion and occupation of Iraq Defeat of Ba'ath Party government and execution of Saddam Hussein Iraqi insurgency, emergence of al-Qaeda in Iraq, and civil war Subsequent depletion of Iraqi insurgency, improvements in public security Establishment of democratic elections and formation of new Shia led government U.S.-Iraq Status of Forces Agreement Withdrawal of U.S. forces from Iraq"
